;nome;modalidade;endereco;situacao_fila;ultima_atualizacao
0;AMA/UBS INTEGRADA JARDIM PAULISTANO / IGREJA BATISTA RENOVADA DO PAULISTANO;POSTO VOLANTE;"IGREJA: R. APARECIDA DO TABOADO,505 - JD PAULISTANO (segunda a sexta das 8 às 17h); UBS: R. ENCRUZILHADA DO SUL, 946 ( segunda a sexta das 17 às 19h, aos sábados das 7 às 19 h).";SEM FILA;2021-06-24 19:01:00
1;UBS VILA TEREZINHA / CRECHE BATUIRA;POSTO VOLANTE;"CRECHE BATUIRA: R. Jorge Píres Ramalho, 70 - Vila Isabel (segunda a sexta, das 8 às 17h); UBS: R. Domingos Francisco Medeiros, 70- Vl.Terezinha (Aos Sábados das 8 às 17h)";NÃO FUNCIONANDO;2021-06-24 19:00:00
2;UBS CASA VERDE / PARÓQUIA NOSSA SENHORA DAS DORES;POSTO VOLANTE;R. ANTONIETA, 19 - CASA VERDE BAIXA - CEP: 02517-070 - Tel: 3950- 0236/ 3966-0247;SEM FILA;2021-06-24 19:00:00
3;POSTO VOLANTE CENTER NORTE ;POSTO VOLANTE;Rua Otto Baumgart, 500;SEM FILA;2021-06-24 16:56:00
4;IGREJA DE SÃO JUDAS;POSTO VOLANTE;Alameda Guaiós,145;FILA GRANDE;2021-06-24 16:12:00
5;SHOPPING METRÔ SANTA CRUZ;POSTO VOLANTE;Rua Domingos de Morais (acesso pela Externa);AGUARDANDO ABASTECIMENTO;2021-06-24 18:09:00
6;ARENA CORINTHIANS;DRIVE-THRU;Av. Miguel Ignácio, 2492 Curi, Portão E4 -CEP: 08295-005;SEM FILA;2021-06-24 15:53:00
7;AUTÓDROMO DE INTERLAGOS;DRIVE-THRU;Rua Jacinto Júlio, altura do nº 589 – Portão 9, entrada KRF - CEP: 04815-160;NÃO FUNCIONANDO;2021-06-24 17:37:00
8;CLUB ATHLETICO PAULISTANO;DRIVE-THRU;R. Honduras, 1.400 - Jardim América - CEP: 01428-900;SEM FILA;2021-06-24 17:11:00
9;CLUBE ATLÉTICO MONTE LÍBANO;DRIVE-THRU;Rua do Gama, 261 - Jardim Luzitania - CEP: 04032-000;AGUARDANDO ABASTECIMENTO;2021-06-24 16:11:00
10;HOSPITAL DOM ALVARENGA;DRIVE-THRU;Av. Nazaré, 1361 - Ipiranga - CEP: 04263-200;SEM FILA;2021-06-24 15:58:00
11;IGREJA BOAS NOVAS;DRIVE-THRU;Rua Marechal Mallet, 535, Vila Prudente - CEP: 03140-020;SEM FILA;2021-06-24 16:55:00
12;MEMORIAL DA AMÉRICA LATINA;DRIVE-THRU;Rua Tagipuru, 500 (referência Portão 2) - CEP: 01156-000;SEM FILA;2021-06-24 14:46:00
13;PARQUE VILLA LOBOS;DRIVE-THRU;Av. Prof. Fonseca Rodrigues, 1025- Portão 3 - Alto de Pinheiros - CEP 05461-010;SEM FILA;2021-06-24 16:50:00
14;SHOPPING ANALIA FRANCO;DRIVE-THRU;Av. Reg. Feijó, 1739 - Tatuapé, São Paulo - CEP: 03342-900;FILA PEQUENA;2021-06-24 17:03:00
15;SHOPPING ARICANDUVA;DRIVE-THRU;Avenida Aricanduva, 5555 – Estacionamento Auto Shopping Acesso pelo Portão P4 - CEP: 03930-110;SEM FILA;2021-06-24 15:57:00
16;SHOPPING CAMPO LIMPO;DRIVE-THRU;Estrada do Campo Limpo, 459. Vila Prel – CEP: 05777-001;NÃO FUNCIONANDO;2021-06-24 17:15:00
17;SHOPPING INTERLAGOS;DRIVE-THRU;Av. Interlagos, 2255 - Estacionamento Subsolo, portão5 - Interlagos - CEP: 04661-200;NÃO FUNCIONANDO;2021-06-24 17:45:00
18;SUBPREFEITURA DE ITAIM PAULISTA;DRIVE-THRU;Avenida Marechal Tito, 3012 - Itaim Paulista - CEP: 08160-495;SEM FILA;2021-06-24 16:11:00
19;SUBPREFEITURA DE M BOI MIRIM;DRIVE-THRU;Avenida Guarapiranga, 1695 – Pq Alves de Lima - CEP: 04902-005;NÃO FUNCIONANDO;2021-06-24 17:06:00
20;CANTAREIRA NORTE SHOPPING;DRIVE-THRU;AVENIDA RAIMUNDO PEREIRA DE MAGALHÃES 11001;SEM FILA;2021-06-24 16:52:00
21;CENTRO DE EXPOSIÇÕES DO ANHEMBI;DRIVE-THRU;Rua Olavo Fontoura, portão 38 - CEP: 02012-021;NÃO FUNCIONANDO;2021-06-24 16:59:00
22;MEGA DRIVE - CRESAN VILA MARIA;DRIVE-THRU;Rua Gastão Madeira, 226;SEM FILA;2021-06-24 16:56:00
23;CLUBE PAINEIRAS;DRIVE-THRU;Av. Dr. Alberto Penteado, 605;SEM FILA;2021-06-24 16:48:00
24;SHOPPING JARDIM SUL;DRIVE-THRU;Acesso pela Rua Nelson Gama de Oliveira (lateral do Shopping) s/n - Vila Andrade;NÃO FUNCIONANDO;2021-06-24 17:07:00
25;NOVARTIS BIOCIÊNCIA S.A.;DRIVE-THRU;Av. Professor Vicente Rao, 90 -Cidade Monções - CEP: 04706-900;NÃO FUNCIONANDO;2021-06-24 17:07:00
26;MEGA POSTO DE VACINAÇÃO - GALERIA PRESTES MAIA;MEGAPOSTO;Praça do Patriarca, nº2 - Sé;FILA MÉDIA;2021-06-24 16:51:00
27;MEGA POSTO SESI AE CARVALHO;MEGAPOSTO;Rua Deodato saraiva da silva, 110 - Arthur Alvim, São Paulo - 03694-090;SEM FILA;2021-06-24 15:53:00
28;MEGA POSTO DE VACINAÇÃO - SHOPPING ARICANDUVA;MEGAPOSTO;AVENIDA ARICANDUVA, 5555 - ESTACIONAMENTO AUTO SHOPPING - ACESSO PELO PORTÃO 4 - CEP: 03930-110;SEM FILA;2021-06-24 15:57:00
29;MEGA POSTO - CATEDRAL DE SAO MIGUEL PAULISTA;MEGAPOSTO;Av. São Miguel - Praça Padre Aleixo Monteiro Mafra (Praça do Forró);SEM FILA;2021-06-24 16:00:00
30;CLUBE HEBRAICA;MEGAPOSTO;Rua Ibiapinopolis, 781- na parte superior do Clube - CEP: 01455-110;FILA GRANDE;2021-06-24 17:02:00
31;SHOPPING RAPOSO;MEGAPOSTO;Rodovia Raposo Tavares KM 14,5 . Entrada principal.;SEM FILA;2021-06-24 16:46:00
32;METRÔ BUTANTÃ - LINHA AMARELA;MEGAPOSTO;Acesso A - Av. Vital Brasil, N°427 / Acesso B - Pirajussara, Nº 438 Acesso C - Eng. Bianor, Nº 78;NÃO FUNCIONANDO;2021-06-24 16:55:00
33;ALLIANZ PARK;MEGAPOSTO;AV FRANCISCO MATARAZZO, 1.705;SEM FILA;2021-06-24 17:29:00
34;CLUB ATHLETICO PAULISTANO;MEGAPOSTO;R. Honduras, 1.400 - Jardim América - CEP: 01428-900;FILA PEQUENA;2021-06-24 17:12:00
35;MEGA POSTO EXTRA HIPERMERCADO - AEROPORTO;MEGAPOSTO;ACESSO PELA RUA BRÁS DE ARZÃO, 194;NÃO FUNCIONANDO;2021-06-24 17:48:00
36;MEGA POSTO PETZ;MEGAPOSTO;AV. SEN. TEOTONIO VILELA, 4482 - VILA SÃO JOSÉ -  S.PAULO - 04864-001;NÃO FUNCIONANDO;2021-06-24 18:52:00
37;MEGA POSTO CENTRO CULTURAL GRAJAÚ;MEGAPOSTO;RUA PROFESSOR OSCAR BARRETO FILHO, 252 - PARQUE AMÉRICA/SP - 04822-230;NÃO FUNCIONANDO;2021-06-24 17:03:00
38;MEGA POSTO DE VACINAÇÃO - JARDIM ANGELA;MEGAPOSTO;Estrada do M Boi Mirim, 5203 - Edificio Garagem ( ao lado do Terminal Jd Angela);NÃO FUNCIONANDO;2021-06-24 17:08:00
39;MEGA POSTO DE VACINAÇÃO - CENTRO EMPRESARIAL DE SÃO PAULO;MEGAPOSTO;Av. Maria Coelho Aguiar, 215;NÃO FUNCIONANDO;2021-06-24 17:10:00
40;SHOPPING IBIRAPUERA;MEGAPOSTO;Av. Moaci, s/n;NÃO FUNCIONANDO;2021-06-24 17:58:00
41;MEGA POSTO DE VACINAÇÃO - UNISA SANTO AMARO;MEGAPOSTO;Rua Isabel Schmidt, 349;NÃO FUNCIONANDO;2021-06-24 17:00:00
42;UBS HUMAITÁ - DR. JOÃO DE AZEVEDO LAGE;POSTO FIXO;R. HUMAITÁ, 520 - BELA VISTA - CEP: 01321-010 - Tel: 3241- 1632/ 3241-1163;FILA MÉDIA;2021-06-24 17:55:00
43;UBS NOSSA SENHORA DO BRASIL - ARMANDO DARIENZO;POSTO FIXO;R. ALMIRANTE MARQUES LEÃO, 684 - BELA VISTA - CEP: 01330- 010 - Tel: 3284-4601/ 3541-3704;FILA GRANDE;2021-06-24 16:55:00
44;UBS BOM RETIRO - DR. OCTAVIO AUGUSTO RODOVALHO;POSTO FIXO;R. TENENTE PENA, 8 - BOM RETIRO - CEP: 01127-020 - Tel: 3222-0619/ 3224-9903;FILA MÉDIA;2021-06-24 16:56:00
45;UBS CAMBUCI;POSTO FIXO;AV. LACERDA FRANCO, 791 - CAMBUCI - CEP: 01536-000 - Tel: 3276-6480/ 3209-3304;FILA PEQUENA;2021-06-24 17:53:00
46;CENTRO DE SAÚDE ESCOLA BARRA FUNDA – CSEBF;POSTO FIXO;Endereço: Avenida Dr. Abraão Ribeiro, 283 Bom retiro São Paulo – SP;SEM FILA;2021-06-24 16:16:00
47;SAE DST/AIDS CAMPOS ELÍSEOS;POSTO FIXO;Alameda Cleveland, 374;NÃO FUNCIONANDO;2021-06-24 17:16:00
48;UBS BORACEA;POSTO FIXO;R. BORACEA, 270 - SANTA CECÍLIA - CEP: 01135-010 - Tel: 3392- 1281/ 3392-1882;FILA PEQUENA;2021-06-24 17:51:00
49;UBS SANTA CECÍLIA - HUMBERTO PASCALE;POSTO FIXO;R. VITORINO CARMILO, 599 - CAMPOS ELÍSEOS - CEP: 01153- 000 - Tel: 3826-0096/ 3826-7970;FILA GRANDE;2021-06-24 16:59:00
50;UBS REPÚBLICA - FERNANDA SANTE LIMEIRA;POSTO FIXO;PRAÇA PATRIARCA, 100 - CENTRO - CEP: 01002010 - Tel: 3242- 3756/ 3241-5515;FILA MÉDIA;2021-06-24 16:50:00
51;UBS SÉ;POSTO FIXO;R. FREDERICO ALVARENGA, 259 - PQ DOM PEDRO - CEP: 01020-030 - Tel: 3101-2344/ 3101-3013;SEM FILA;2021-06-24 16:56:00
52;AMA/UBS INTEGRADA AGUA RASA;POSTO FIXO;R. SERRA DE JAIRE, 1480 - ÁGUA RASA - CEP: 03175-001 - Tel: 2605-2156/ 2605-5307;FILA PEQUENA;2021-06-24 17:56:00
53;AMA/UBS INTEGRADA VILA ORATÓRIO - DR. TITO PEDRO MASCELANI;POSTO FIXO;R. JOÃO FIALHO DE CARVALHO, 35 - VL DIVA - CEP: 03345-010 - Tel: 2301-2979/ 2911-5318;FILA MÉDIA;2021-06-24 17:56:00
54;UBS VILA BERTIOGA - DOMINGOS DELASCIO;POSTO FIXO;R. FAROL PAULISTANO, 410 - ALTO DA MOOCA - CEP: 03192- 060 - Tel: 2965-1066/ 2021-7210;FILA PEQUENA;2021-06-24 18:01:00
55;AMA/UBS INTEGRADA VILA ANTONIETA;POSTO FIXO;R. CORONEL JOÃO DE OLIVEIRA MELO, 440 - VL ANTONIETA - CEP: 03474-020 - Tel: 2725-3997/ 2253-1852;FILA PEQUENA;2021-06-24 18:01:00
56;UBS JARDIM IVA;POSTO FIXO;R. MIGUEL BASTOS SOARES, 55 - JD IVA - CEP: 03910-000 - Tel: 2211-0884/ 2911-1006;SEM FILA;2021-06-24 17:52:00
57;UBS VILA NOVA YORK;POSTO FIXO;R. DR EDGARD MAGALHÃES NORONHA, 200 - VL NOVA YORK - CEP: 03480-000 - Tel: 2721-2707;SEM FILA;2021-06-24 17:50:00
58;AMA/UBS INTEGRADA JARDIM NORDESTE;POSTO FIXO;R. NICOLO TARTAGLIA, 45 - JD COIMBRA - CEP: 03693-050 - Tel: 2280-6211;SEM FILA;2021-06-24 17:56:00
59;AMA/UBS INTEGRADA PADRE MANOEL DA NÓBREGA;POSTO FIXO;AV. PADRE FRANCISCO DE TOLEDO, 545 - ARTHUR ALVIM - CEP: 03590-120 - Tel: 2741-7296/ 2748-6082;SEM FILA;2021-06-24 17:54:00
60;UBS ANTONIO ESTEVÃO DE CARVALHO;POSTO FIXO;R. JAPANI, 7 - CIDADE AE CARVALHO - CEP: 08220-130 - Tel: 2280-2373/ 2043-3400;SEM FILA;2021-06-24 17:51:00
61;UBS ANTONIO PIRES F VILLA LOBO;POSTO FIXO;R. COELHO DE CASTRO, 95 - VL NHOCUNÉ - CEP: 03560-030 - Tel: 2749-3521;SEM FILA;2021-06-24 18:00:00
62;UBS JARDIM SÃO NICOLAU;POSTO FIXO;R. BROOK TAYLOR, 30 - JD NORDESTE - CEP: 03690000 - Tel: 2280-7508/ 2280-1508;SEM FILA;2021-06-24 17:57:00
63;UBS PADRE JOSE DE ANCHIETA;POSTO FIXO;AV. SILVIO TORRES, 313 - ARTHUR ALVIM - CEP: 03589-010 - Tel: 2742-1367;FILA PEQUENA;2021-06-24 18:00:00
64;UBS PARQUE ARTHUR ALVIM;POSTO FIXO;R. HENRIQUE JACOBS, 269 - ARTHUR ALVIM - CEP: 03566-010 - Tel: 2749-4235/ 2958-4235;SEM FILA;2021-06-24 18:00:00
65;UBS BELENZINHO - MARCUS WOLOSKER;POSTO FIXO;AV. CELSO GARCIA, 1749 - BELENZINHO - CEP: 03015-000 - Tel: 2292-5687/ 2694-2697;FILA PEQUENA;2021-06-24 17:58:00
66;UBS BRAS - DR. MANOEL SALDIVA NETO;POSTO FIXO;R. SAMPSON, 61 - BRÁS - CEP: 03013-040 - Tel: 2692-0788/ 2292- 5453;FILA PEQUENA;2021-06-24 17:52:00
67;AMA/UBS INTEGRADA CANGAÍBA - DR. CARLOS GENTILE DE MELLO;POSTO FIXO;AV. CANGAIBA, 3722 - CANGAÍBA - CEP: 03712-001 - Tel: 2621- 6523/ 2621-9507;FILA MÉDIA;2021-06-24 17:57:00
68;AMA/UBS INTEGRADA CHACARA CRUZEIRO DO SUL - ZELIA L M DORO;POSTO FIXO;R. MERCEDES LOPES, 989 - CHÁCARA CRUZEIRO DO SUL - CEP: 03614-000 - Tel: 2647-0031/ 2642-2622;SEM FILA;2021-06-24 17:54:00
69;AMA/UBS INTEGRADA VILA SILVIA;POSTO FIXO;R. BELEM DOS SANTOS (ESQUINA COM R. LAURO DE FREITAS), 222 - VILA SILVIA - CEP: 03821-170 - Tel: 2545-6838/ 2545-8181;FILA PEQUENA;2021-06-24 17:55:00
70;UBS ENGENHEIRO GOULART - DR. JOSÉ PIRES;POSTO FIXO;R. AUGUSTO CORREIA LEITE, 538 - ENG. GOULART - CEP: 03726-100 - Tel: 2621-7402/ 2621-7042;SEM FILA;2021-06-24 18:00:00
71;UBS JARDIM SÃO FRANCISCO;POSTO FIXO;R. JURITI PIRANGA, 195 - CANGAÍBA - CEP: 03718-020 - Tel: 2957-2808/ 2681-0250;FILA PEQUENA;2021-06-24 17:56:00
72;AMA/UBS INTEGRADA VILA CARRÃO - DR. ADHEMAR MONTEIRO PACHECO;POSTO FIXO;R. DR JACI BARBOSA, 280 - VL CARRÃO - CEP: 03447-000 - Tel: 2785-4728/ 2036-3853;SEM FILA;2021-06-24 17:50:00
73;UBS VILA NOVA MANCHESTER - DR. ARLINDO GENNARI;POSTO FIXO;PRAÇA HAROLDO DALTRO, 461 - VL NOVA MANCHESTER - CEP: 03444-090 - Tel: 2295-4163/ 2296-6843;FILA MÉDIA;2021-06-24 17:55:00
74;AMA/UBS INTEGRADA JARDIM BRASILIA;POSTO FIXO;AV. OSVALDO VALLE CORDEIRO, 245 - JD BRASILIA - CEP: 03584-000 - Tel: 2741-6938/ 2743-9476;SEM FILA;2021-06-24 18:00:00
75;AMA/UBS INTEGRADA VILA ITAPEMA;POSTO FIXO;R. COSTEIRA, 572 - JD ARISI - CEP: 03573-010 - Tel: 4780-5103/ 2724-6146;SEM FILA;2021-06-24 18:00:00
76;SAE DST/AIDS CIDADE LIDER II;POSTO FIXO;R. MEDIO IGUACU, 86 - CIDADE LIDER - CEP 08285130 - Tel: 27480255 / 27481139;SEM FILA;2021-06-24 17:53:00
77;UBS CIDADE LIDER;POSTO FIXO;AV. DR FRANCISCO MUNHOZ FILHO, 379 - CIDADE LIDER - CEP: 08280-000 - Tel: 2741-1563/ 2017-2743;SEM FILA;2021-06-24 17:59:00
78;UBS JARDIM MARILIA;POSTO FIXO;R. ELZA DOS ANJOS NEVES, 100 - CIDADE LIDER - CEP: 03585- 100 - Tel: 2743-9526/ 2746-3008;SEM FILA;2021-06-24 18:05:00
79;UBS JARDIM SANTA MARIA;POSTO FIXO;R. EMBIRATAÍ, 201 - JD SANTA MARIA - CEP: 03576-000 - Tel: 2724-7004/ 2727-4160;FILA PEQUENA;2021-06-24 17:49:00
80;UBS JARDIM SANTA TEREZINHA;POSTO FIXO;AV. DOS LATINOS, 205 - JD SANTA TEREZINHA - CEP: 03572- 000 - Tel: 2721-1815/ 2725-0711;FILA PEQUENA;2021-06-24 18:04:00
81;AMA/UBS INTEGRADA FAZENDA DO CARMO;POSTO FIXO;R. FRANCISCO CARDOSO JR., 10 - CIDADE TIRADENTES - CEP: 08421-105 - Tel: 4780-5109/ 2556-7600;SEM FILA;2021-06-24 17:55:00
82;UBS BARRO BRANCO;POSTO FIXO;R. EDUARDO REUTER, 678 - COHAB BARRO BRANCO II - CEP: 08473-533 - Tel: 4780-5068/ 2964-8826;SEM FILA;2021-06-24 17:03:00
83;UBS CARLOS GENTILE DE MELO;POSTO FIXO;AV. DOS TÊXTEIS, 3765 - CIDADE TIRADENTES - CEP: 08490- 600 - Tel: 4780-5108/ 2964-8081;SEM FILA;2021-06-24 16:47:00
84;UBS CASTRO ALVES;POSTO FIXO;R. CADERNO DE VIAGEM, 55 - COHAB CASTRO ALVES - CEP: 08474-170 - Tel: 4780-5077/ 2282-0320;SEM FILA;2021-06-24 17:51:00
85;UBS CIDADE TIRADENTES I - LUIS MARANHÃO;POSTO FIXO;AV. DOS TÊXTEIS, 512 - CIDADE TIRADENTES - CEP: 08490-600 - Tel: 4780-5110/ 2282-0250;FILA PEQUENA;2021-06-24 17:52:00
86;UBS DOM ANGELICO;POSTO FIXO;ESTRADA MANOEL OLIVEIRA RAMOS, 1 - CIDADE TIRADENTES - CEP: 08473-000 - Tel: 2555-3894/ 4780-5062;SEM FILA;2021-06-24 18:02:00
87;UBS FERROVIÁRIOS;POSTO FIXO;R. GONÇALVES NINA, 58 - CIDADE TIRADENTES - CEP: 08470- 610 - Tel: 2285-6477/ 4780-5063;SEM FILA;2021-06-24 17:50:00
88;UBS GRÁFICOS;POSTO FIXO;R. FRANCISCO JOSE VIANA, 708 - CIDADE TIRADENTES - CEP: 08471-530 - Tel: 2285-5685/ 4780-5065;SEM FILA;2021-06-24 18:20:00
89;UBS INACIO MONTEIRO;POSTO FIXO;R. INÁCIO MONTEIRO, 3002 - CIDADE TIRADENTES - CEP: 08490-000 - Tel: 4780-5066/ 2555-6455;SEM FILA;2021-06-24 17:58:00
90;UBS JARDIM VITÓRIA;POSTO FIXO;R. LAGEDO, 123 - CIDADE TIRADENTES - CEP: 08490-000 - Tel: 4780-5061/ 2964-2685;SEM FILA;2021-06-24 17:53:00
91;UBS NASCER DO SOL;POSTO FIXO;R. SENADOR NELSON CARNEIRO, 617 - CIDADE TIRADENTES - CEP: 08485300 - Tel: 4810-7700;SEM FILA;2021-06-24 17:57:00
92;UBS PREFEITO PRESTES MAIA;POSTO FIXO;R. INACIO PINTO LIMA, 35 - CIDADE TIRADENTES - CEP: 08490- 020 - Tel: 2555-5587/ 4780-5064;SEM FILA;2021-06-24 17:57:00
93;UBS PROFETA JEREMIAS;POSTO FIXO;R. LUIS BORDESE, 63 - CIDADE TIRADENTES - CEP: 08471-710 - Tel: 4780-5067/ 2558-3866;SEM FILA;2021-06-24 17:59:00
94;AMA/UBS INTEGRADA PROF. DR. HUMBERTO CERRUTI - PQ BOTURUSSU;POSTO FIXO;AV. OLAVO EGÍDIO DE SOUZA ARANHA, 704 - VL CISPER - CEP: 03822-000 - Tel: 2943-9991/ 2541-4685;SEM FILA;2021-06-24 17:55:00
95;UBS ERMELINO MATARAZZO;POSTO FIXO;R. ANTONIO DE FREITAS TOLEDO, 170 - ERMELINO MATARAZZO - CEP: 03809-060 - Tel: 2545-8235/ 2542-0945;FILA PEQUENA;2021-06-24 17:50:00
96;UBS JARDIM KERALUX;POSTO FIXO;R. LUCAS GONCALVES, 13 - JD KERALUX - CEP: 03828-000 - Tel: 2546-6177/ 2542-0837;SEM FILA;2021-06-24 17:51:00
97;UBS PEDRO DE SOUZA CAMPOS;POSTO FIXO;R. PAULO BIFANO ALVES, 764 - PQ BOTURUSSU - CEP: 03801- 000 - Tel: 2546-4111/ 2542-0663;SEM FILA;2021-06-24 17:54:00
98;UBS VILA CISPER;POSTO FIXO;R. CACULÉ, 79 - VL CISPER - CEP: 03817-220 - Tel: 2546-5100/ 2542-0154;SEM FILA;2021-06-24 18:01:00
99;UBS VILA PARANAGUÁ;POSTO FIXO;R. JOSÉ GOES NOGUEIRA, 70 - VL PARANAGUÁ - CEP: 03807- 380 - Tel: 2943-8044/ 2546-0098;SEM FILA;2021-06-24 18:46:00
100;AE SAO CARLOS;POSTO FIXO;R MACABU FONE: (11)2016-9559;SEM FILA;2021-06-24 18:00:00
101;AMA PRES JUSCELINO KUBITSCHEK;POSTO FIXO;AV UTARO KANAI FONE: (11)25554474;SEM FILA;2021-06-24 17:50:00
102;UBS GUAIANASES II;POSTO FIXO;R. COMANDANTE CARLOS RUHL, 189 - GUAIANASES - CEP: 08410-120 - Tel: 4780-5095/ 2554-4064;SEM FILA;2021-06-24 18:01:00
103;UBS JARDIM SOARES;POSTO FIXO;R. FELICIANO DE MENDONÇA, 496 - JD SOARES - CEP: 08460- 365 - Tel: 4780-5035/ 2557-7022;SEM FILA;2021-06-24 17:55:00
104;UBS PREFEITO CELSO AUGUSTO DANIEL;POSTO FIXO;R. JORGE MARACCINI PONFILIO, 210 - CJ. HAB JUSCELINO KUBITSCHEK - CEP: 08465-050 - Tel: 4780-5034/ 2556-7997;SEM FILA;2021-06-24 18:04:00
105;UBS VILA COSMOPOLITA;POSTO FIXO;R. ALDEIA MARIA, 258 - GUAIANASES - CEP: 08021-070 - Tel: 4780-5033/ 2555-8583;SEM FILA;2021-06-24 18:09:00
106;AMA/UBS INTEGRADA JARDIM DA CONQUISTA III;POSTO FIXO;TRAVESSA SOMOS TODOS IGUAIS, 330 - SÃO MATEUS - CEP: 08343-000 - Tel: 2735-4202;SEM FILA;2021-06-24 18:01:00
107;AMA/UBS INTEGRADA JARDIM DAS LARANJEIRAS;POSTO FIXO;R. BENTO GUELFI, 1100 - JD DA LARANJEIRAS - CEP: 08381-001 - Tel: 2731-7252;SEM FILA;2021-06-24 17:59:00
108;UBS CDHU PALANQUE;POSTO FIXO;R. PONTE DA AMIZADE (ALT. AV. RAGUEB CHOHFI, 7208), 2 - JD PALANQUE - CEP: 08375-000 - Tel: 2735-3820;SEM FILA;2021-06-24 18:00:00
109;UBS JARDIM DA CONQUISTA II;POSTO FIXO;TRAVESSA SOMOS TODOS IGUAIS, 915 - JD CONQUISTA - CEP: 08343-000 - Tel: 2253-9547/ 2735-3079;SEM FILA;2021-06-24 18:00:00
110;UBS JARDIM ROSELI;POSTO FIXO;R. SIMÃO NUNES, 31 - JD ROSELI - CEP: 08380-039 - Tel: 2731- 5143;SEM FILA;2021-06-24 18:00:00
111;UBS PARQUE BOA ESPERANÇA;POSTO FIXO;AV. RAGUEB CHOHFI, 3826 - JD AUGUSTO - CEP: 08490-500 - Tel: 2731-6484/ 2731-0669;SEM FILA;2021-06-24 18:16:00
112;UBS RECANTO VERDE SOL;POSTO FIXO;ESTRADA DOS FIDELIS, 10 - RECANTO VERDE SOL - CEP: 08382505 - Tel: 2734-3271;SEM FILA;2021-06-24 18:07:00
113;AMA/UBS INTEGRADA JARDIM DAS OLIVEIRAS;POSTO FIXO;R. JOSÉ DA CRUZ CAMARGO, 174 - ITAIM PAULISTA - CEP: 08122-100 - Tel: 2572-0367/ 2963-2415;FILA PEQUENA;2021-06-24 18:01:00
114;UBS CIDADE KEMEL;POSTO FIXO;AV. KEMEL ADDAS, 1031 - CIDADE KEMEL - CEP: 08131-220 - Tel: 2963-2346/ 2569-0515;SEM FILA;2021-06-24 18:16:00
115;UBS DR. ATUALPA GIRÃO RABELO;POSTO FIXO;R. ILHA DO ARVOREDO, 10 - VL MORGADO - CEP: 08140-270 - Tel: 4780-5087/ 2963-2634;SEM FILA;2021-06-24 19:02:00
116;UBS ENCOSTA NORTE;POSTO FIXO;R. RENATA AGONDI, 238 - ITAIM PAULISTA - CEP: 08131320 - Tel: 4780-5113/ 4780-2937;FILA MÉDIA;2021-06-24 17:45:00
117;UBS ITAIM PAULISTA - DR. JÚLIO DE GOUVEIA;POSTO FIXO;PRAÇA MAJOR JOSE LEVY SOBRINHO, 139 - ITAIM PAULISTA - CEP: 08110-460 - Tel: 2561-9443/ 2572-0672;SEM FILA;2021-06-24 17:55:00
118;UBS JARDIM CAMARGO NOVO;POSTO FIXO;R. GENERAL PEREIRA DE BERREDO, 275 - JD CAMARGO NOVO - CEP: 08121-260 - Tel: 2567-5959/ 2963-2610;SEM FILA;2021-06-24 17:53:00
119;UBS JARDIM INDAIÁ;POSTO FIXO;R. ANTONIO LEME DA GUERRA, 182 - ITAIM PAULISTA - CEP: 08141-130 - Tel: 2561-7904/ 2963-3711;SEM FILA;2021-06-24 17:55:00
120;UBS JARDIM NÉLIA;POSTO FIXO;R. ITAJUIBE, 1910 - ITAIM PAULISTA - CEP: 08142-000 - Tel: 4780- 5074/ 2963-3802;SEM FILA;2021-06-24 18:01:00
121;AMA/UBS INTEGRADA AGUIA DE HAIA;POSTO FIXO;R. TANTAS PALAVRAS, 59 - COHAB ÁGUIA DE HAIA - CEP: 08223-510 - Tel: 4780-5107/ 3756-3264;SEM FILA;2021-06-24 17:50:00
122;AMA/UBS INTEGRADA PARADA XV DE NOVEMBRO;POSTO FIXO;R. IBIAJARA, 804 - PARADA XI DE NOVEMBRO - CEP: 08246-101 - Tel: 2286-0017/ 2071-3232;SEM FILA;2021-06-24 18:01:00
123;AMA/UBS INTEGRADA VILA CARMOSINA;POSTO FIXO;R. IPOPOCA, 61 - ITAQUERA - CEP: 08290-330 - Tel: 2524-7796/ 2521-8544;SEM FILA;2021-06-24 17:58:00
124;UBS ITAQUERA;POSTO FIXO;R. AMÉRICO SALVADOR NOVELLI, 265 - ITAQUERA - CEP: 08210-090 - Tel: 2286-0015/ 2071-2422;FILA PEQUENA;2021-06-24 17:54:00
125;UBS URSI CONJUNTO AE CARVALHO;POSTO FIXO;R. CORRE CORRE, 30 - COHAB AE CARVALHO - CEP: 08225550 - Tel: 4780-5111;SEM FILA;2021-06-24 17:59:00
126;UBS VILA NOSSA SENHORA APARECIDA;POSTO FIXO;R. PAULINO SERQUEIRA x GUAIA GUAÇU, 1 - ITAQUERA - CEP: 08215-160 - Tel: 2079-7871/ 2073-6039;FILA PEQUENA;2021-06-24 17:53:00
127;UBS VILA RAMOS - DR. LUIZ AUGUSTO DE CAMPOS;POSTO FIXO;AV. AUGUSTO ANTUNES, 1631 - LIMOEIRO - CEP: 08235-630 - Tel: 4780-5060/ 2052-6945;SEM FILA;2021-06-24 18:01:00
128;UBS VILA REGINA;POSTO FIXO;R. CATARINA LOPES, 450 - VILA REGINA - CEP: 08225-000 - Tel: 2205-6003/ 2944-7662;FILA PEQUENA;2021-06-24 17:52:00
129;UBS VILA SANTANA;POSTO FIXO;R. VITOR JOSE DE CASTRO, 84 - VL SANTANA - CEP: 08240- 300 - Tel: 4780-5059/ 2051-3962;SEM FILA;2021-06-24 17:55:00
130;AMA/UBS INTEGRADA JARDIM HELENA;POSTO FIXO;AV. KUMAKI AOKI, 785 - JD HELENA - CEP: 08090-370 - Tel: 2581- 1661/ 2586-2971;SEM FILA;2021-06-24 18:14:00
131;AMA/UBS INTEGRADA PARQUE PAULISTANO;POSTO FIXO;R. SILVEIRA PIRES, 265 - PARQUE PAULISTANO - CEP: 08080- 160 - Tel: 2025-9469/ 2025-9468;FILA PEQUENA;2021-06-24 17:59:00
132;UBS JARDIM MAIA;POSTO FIXO;R. MARFIM VEGETAL, 108 - JD MAIA - CEP: 08081-330 - Tel: 2581-6962;SEM FILA;2021-06-24 17:53:00
133;UBS JD ROMANO VILA ITAIM;POSTO FIXO;R. RIO MANUEL ALVES, 182 - ITAIM PAULISTA - CEP: 08190-450 - Tel: 2581-3737/ 3678-5222;SEM FILA;2021-06-24 18:07:00
134;UBS TRÊS PONTES;POSTO FIXO;R. CAPACHOS, 136 - JARDIM CELIA - CEP: 08191330 - Tel: 4780- 5112;SEM FILA;2021-06-24 18:00:00
135;AMA/UBS INTEGRADA JOSÉ BONIFÁCIO I;POSTO FIXO;AV. PROF. OSVALDO DE OLIVEIRA, 610 - JD HELENA - CEP: 08420-280 - Tel: 2557-8844/ 2557-5136;SEM FILA;2021-06-24 18:00:00
136;AMA/UBS INTEGRADA JOSE BONIFACIO III - DRA. LUCY MAYUMI UDAKIRI;POSTO FIXO;R. SILVIO BARBINI, 40 - ITAQUERA - CEP: 08250-650 - Tel: 2944- 6086/ 2071-2500;FILA PEQUENA;2021-06-24 17:57:00
137;UBS JARDIM SÃO PEDRO - FRANCISCO ANTONIO CESARONI;POSTO FIXO;R. SILVIANOPOLIS, 370 - JD SÃO PEDRO - CEP: 08420-680 - Tel: 2552-5355/ 2557-8938;SEM FILA;2021-06-24 17:54:00
138;UBS JOSE BONIFACIO II;POSTO FIXO;R. MURMÚRIOS DA TARDE, 30 - COHAB JOSE BONIFÁCIO - CEP: 08253-580 - Tel: 2521-1226/ 2521-5325;SEM FILA;2021-06-24 19:01:00
139;UBS GUAIANAZES;POSTO FIXO;R. PROFESSOR COSME DEODATO TADEU, 90 - GUAIANASES - CEP: 08450-380 - Tel: 4780-5030/ 2557-8177;SEM FILA;2021-06-24 17:54:00
140;UBS JARDIM AURORA;POSTO FIXO;AV. CLAUDIO DA COSTA, 54 - GUAIANASES - CEP: 08431-160 - Tel: 4780-5093/ 2035-1671;SEM FILA;2021-06-24 18:25:00
141;UBS JARDIM BANDEIRANTES;POSTO FIXO;R. PACHECO ARANHA, 4 - GUAIANASES - CEP: 08450-410 - Tel: 4780-5027/ 2557-5273;FILA MÉDIA;2021-06-24 18:04:00
142;UBS JARDIM ETELVINA;POSTO FIXO;R. MANUEL TEODORO XAVIER, 138 - GUAIANASES - CEP: 08430-570 - Tel: 4780-5071/ 2035-1756;SEM FILA;2021-06-24 18:00:00
143;UBS JARDIM FANGANIELLO;POSTO FIXO;R. FRANCISCO NUNES CUBAS, 60 - LAJEADO - CEP: 08450-460 - Tel: 4780-5029/ 2557-6698;SEM FILA;2021-06-24 18:00:00
144;UBS JARDIM ROBRU - GUAIANASES;POSTO FIXO;AV. NORDESTINA, 5593 - LAJEADO - CEP: 08431-410 - Tel: 4780- 5094/ 2035-1860;SEM FILA;2021-06-24 17:56:00
145;UBS PRIMEIRO DE OUTUBRO;POSTO FIXO;TRAVESSA AÇUCENA DO BREJO, 16 B - JD LOURDES - CEP: 08441-010 - Tel: 2035-8010/ 4780-5032;SEM FILA;2021-06-24 17:52:00
146;UBS SANTA LUZIA;POSTO FIXO;R. CONJUNTO DA PAZ, 39 - JD MIRIAM - CEP: 08142-360 - Tel: 2569-1887/ 4780-5031;SEM FILA;2021-06-24 17:59:00
147;UBS VILA CHABILÂNDIA;POSTO FIXO;ESTRADA DO LAGEADO VELHO, 392 - LAJEADO - CEP: 08451- 000 - Tel: 4780-5092/ 2557-9571;SEM FILA;2021-06-24 18:21:00
148;AE MOOCA - ITALO DOMINGOS LE VOCCI;POSTO FIXO;R. Marina Crespi, 91;AGUARDANDO ABASTECIMENTO;2021-06-24 18:48:00
149;UBS MOOCA I;POSTO FIXO;R. TAQUARI, 549 - MOOCA - CEP: 03166-000 - Tel: 2618-5255/ 2291-5517;FILA GRANDE;2021-06-24 17:52:00
150;AMA/UBS INTEGRADA PARI;POSTO FIXO;R. DAS OLARIAS, 503 - CANINDÉ - CEP: 03030-020 - Tel: 3227- 0081;SEM FILA;2021-06-24 18:54:00
151;UBS GLEBA DO PÊSSEGO - VICENTE FIUZA DA COSTA;POSTO FIXO;R. CONFISSÃO, 786 - PQ DO CARMO - CEP: 08265-230 - Tel: 2522-3177/ 2521-8840;SEM FILA;2021-06-24 16:52:00
152;UBS JARDIM COPA - MATHILDE DE AQUINO DINIZ;POSTO FIXO;R. PONTA DE LUCENA, 330 - ITAQUERA - CEP: 08270-340 - Tel: 2524-5020/ 2522-6763;SEM FILA;2021-06-24 16:55:00
153;UBS JARDIM HELIAN;POSTO FIXO;R. JOÃO BARREIROS, 22 - JARDIM HELIAN - CEP: 08265130 - Tel: 4780-5097/ 2521-7615;SEM FILA;2021-06-24 17:59:00
154;UBS JARDIM NOSSA SENHORA DO CARMO;POSTO FIXO;R. VERÍSSIMO DA SILVA, 136 - JD NOSSA SRA.DO CARMO - CEP: 08275-270 - Tel: 4780-5099/ 2748-5103;SEM FILA;2021-06-24 19:00:00
155;UBS SANTO ESTEVÃO - CARMOSINA;POSTO FIXO;R. CACHOEIRA DA ILHA, 355 - ITAQUERA - CEP: 08270-110 - Tel: 2523-0577;FILA MÉDIA;2021-06-24 18:08:00
156;HOSPITAL DIA REDE HORA CERTA - PENHA;POSTO FIXO;Praça Nossa Sra. da Penha, 55 ;FILA MÉDIA;2021-06-24 18:08:00
157;UBS ENGENHEIRO TRINDADE;POSTO FIXO;AV. GABRIELA MISTRAL, 1168 - ENG. TRINDADE - CEP: 03701- 000 - Tel: 2641-6973/ 2642-7229;SEM FILA;2021-06-24 17:55:00
158;UBS VILA ESPERANÇA - DR. CASSIO BITENCOURT FILHO;POSTO FIXO;R. ALVINÓPOLIS, 1350 - VILA BEATRIZ - CEP: 03645000 - Tel: 2023-1137/ 2957-6630;FILA MÉDIA;2021-06-24 17:53:00
159;UBS VILA ESPERANÇA - DR. EMILIO SANTIAGO DE OLIVEIRA;POSTO FIXO;R. COREMU, 163 - VL ESPERANÇA - CEP: 03647-030 - Tel: 2958- 7502/ 2791-5322;FILA PEQUENA;2021-06-24 17:50:00
160;UBS VILA GRANADA - DR ALFREDO FERREIRA PAULINO FILHO;POSTO FIXO;R. MADALENA JULIA, 60 - VILA GRANADA - CEP: 03660010 - Tel: 2257-1194/ 2685-8036;SEM FILA;2021-06-24 17:50:00
161;AMA/UBS INTEGRADA JARDIM TRÊS MARIAS - DR. MAURICIO ZAMIJOVSKY;POSTO FIXO;R. BRENO ACCIOLI, 440 - VL SÃO FRANCISCO - CEP: 03676-040 - Tel: 2280-4388/ 2043-4617;FILA PEQUENA;2021-06-24 18:29:00
162;SAE DST/AIDS FIDELIS RIBEIRO;POSTO FIXO;R. PEIXOTO, 100 - PONTE RASA - CEP 03627010 - Tel: 26210217;SEM FILA;2021-06-24 15:57:00
163;UBS BURGO PAULISTA;POSTO FIXO;R. JOSÉ SILVA ALCANTARA FILHO, 210 - BURGO PAULISTA - CEP: 03680-000 - Tel: 2280-0080/ 2046-8809;SEM FILA;2021-06-24 17:51:00
164;UBS COSTA MELO;POSTO FIXO;R. LUIS ASSON, 165 - VL MONTEVIDEO - CEP: 03624-010 - Tel: 2958-2981/ 2685-8384;SEM FILA;2021-06-24 17:56:00
165;UBS DR. CARLOS OLIVALDO DE SOUZA LOPES MUNIZ - PONTE RASA;POSTO FIXO;R. JACO BERTILLON, 22 - ALTO DA PONTE RASA - CEP: 03894020 - Tel: 2041-1744/ 2047-3372;SEM FILA;2021-06-24 18:52:00
166;UBS JARDIM PENHA;POSTO FIXO;AV. SÃO MIGUEL, 4331 - PONTE RASA - CEP: 03871-000 - Tel: 2546-5867/ 2214-3227;SEM FILA;2021-06-24 17:54:00
167;UBS JARDIM POPULAR - MATHEUS SANTAMARIA;POSTO FIXO;AV. JAIME TORRES, 600 - JD POPULAR - CEP: 03670-000 - Tel: 2791-6421/ 2685-0439;SEM FILA;2021-06-24 17:52:00
168;AMA/UBS INTEGRADA JARDIM INDEPENDÊNCIA - HERMENEGILDO MORBIN JUNIOR;POSTO FIXO;R. PLANALTO DE CONQUISTA, 80 - JD INDEPENDÊNCIA - CEP: 03223-170 - Tel: 2115-3761/ 2211-2772;FILA PEQUENA;2021-06-24 17:50:00
